{
  "$schema": "https://json-schema.org/draft/2020-12/schema",
  "$id": "https://parfum-finder/schema/site.schema.json",
  "title": "Site profile",
  "description": "Defines how the generic scraping engine talks to one retailer site.",
  "type": "object",
  "additionalProperties": false,
  "properties": {
    "schema_version": { "const": 1 },
    "id": {
      "type": "string",
      "pattern": "^[a-z0-9_-]+$"
    },
    "name": { "type": "string", "minLength": 1 },
    "base_url": {
      "type": "string",
      "format": "uri",
      "pattern": "^https?://.*[^/]$"
    },
    "enabled": { "type": "boolean", "default": true },
    "platform": { "type": ["string", "null"] },
    "strategy": { "enum": ["httpx", "curl_cffi", "playwright"] },
    "extraction": { "enum": ["jsonld", "endpoint", "embedded_json", "css"] },
    "rate_limit_ms": { "type": "integer", "minimum": 0, "default": 800 },
    "timeout_s": { "type": "integer", "minimum": 1, "default": 20 },
    "search": {
      "type": "object",
      "additionalProperties": false,
      "description": "How to run a query and read the result list. The three result selectors are required whatever the product page's extraction layer is, because no search page seen so far carries structured data: the list of hits is always read out of the rendered markup. strategy overrides the site-wide one for this one page, which some sites need when their results are built in the browser but their product pages are not.",
      "properties": {
        "url_template": { "type": "string" },
        "result_item": { "type": "string" },
        "result_url": { "type": "string" },
        "result_title": { "type": "string" },
        "strategy": { "enum": ["httpx", "curl_cffi", "playwright"] },
        "request_headers": {
          "type": "object",
          "additionalProperties": { "type": "string" }
        }
      },
      "required": ["url_template", "result_item", "result_url", "result_title"]
    },
    "request_headers": {
      "description": "Extra HTTP headers sent with this site's requests, merged over the defaults. The search page can replace the set with its own search.request_headers, which some sites need: one platform's variant endpoint answers 200 with an empty body without X-Requested-With: XMLHttpRequest, and answers that same header on its search page with a 404. One platform's variant endpoint answers 200 with an empty body unless the request carries X-Requested-With: XMLHttpRequest. Do not name User-Agent here: the curl_cffi strategy matches its header set to its TLS fingerprint, and overriding one half desyncs the two.",
      "type": "object",
      "additionalProperties": { "type": "string" }
    },
    "variant_control": {
      "description": "The product page's own size picker, as a \"<css>::attr(name)\" or \"<css>::text\" selector matching one option each. When present, a page whose picker offers more sizes than the extraction layer produced rows fails loudly instead of contributing a table that is quietly missing sizes. Options that read as empty are ignored, so a leading \"choose a size\" placeholder does not need excluding. A page the selector does not match at all is not checked: that is a plain full bottle. On a GET endpoint profile this costs one extra request per product, because that layer otherwise never opens the product page.",
      "type": "string"
    },
    "product": {
      "type": "object",
      "additionalProperties": false,
      "properties": {
        "title": { "type": ["string", "null"] },
        "price": { "type": ["string", "null"] },
        "in_stock": { "type": ["string", "null"] },
        "variant_container": { "type": ["string", "null"] }
      }
    },
    "endpoint": {
      "description": "The GET form is one request per product: product_json is a per-product URL template ({base_url}, {product_url}) that already answers with every size. The POST form is for a platform whose endpoint takes one size option per request instead: product_json is then the one fixed endpoint URL ({base_url} only), body maps each static form field to the selector that reads its value off the product page (a product id sitting on the add-to-cart button, for instance), option_selector finds every size option's own id on that page, and option_body_key names the form field one of those ids goes in. One request is sent per option found, and their rows are combined.",
      "type": "object",
      "additionalProperties": false,
      "properties": {
        "product_json": { "type": "string" },
        "method": { "enum": ["GET", "POST"], "default": "GET" },
        "body": {
          "type": "object",
          "additionalProperties": { "type": "string" }
        },
        "option_selector": { "type": "string" },
        "option_body_key": { "type": "string" },
        "variants_path": { "type": "string" },
        "field_map": {
          "type": "object",
          "additionalProperties": false,
          "properties": {
            "size_raw": { "type": "string" },
            "price": { "type": "string" },
            "in_stock": { "type": "string" },
            "title": { "type": "string" },
            "url": { "type": "string" },
            "sku": { "type": "string" }
          },
          "required": ["size_raw", "price", "in_stock"]
        }
      },
      "required": ["product_json", "variants_path", "field_map"],
      "allOf": [
        {
          "if": {
            "properties": { "method": { "const": "POST" } },
            "required": ["method"]
          },
          "then": { "required": ["body", "option_selector", "option_body_key"] }
        }
      ]
    },
    "embedded_json": {
      "description": "Where on the page a JSON blob hides that carries the variant table. source=script reads a <script> body, optionally scanning forward from marker to the JSON value that follows it; source=attribute reads an attribute value. variants_path locates the variant list or size-keyed object inside that JSON, and is omitted when the document itself is the list. In field_map, the value \"@key\" means the key a variant sits under rather than a field inside it.",
      "type": "object",
      "additionalProperties": false,
      "properties": {
        "source": { "enum": ["script", "attribute"] },
        "marker": { "type": "string" },
        "selector": { "type": "string" },
        "attribute": { "type": "string" },
        "variants_path": { "type": "string" },
        "field_map": {
          "type": "object",
          "additionalProperties": false,
          "properties": {
            "size_raw": { "type": "string" },
            "price": { "type": "string" },
            "in_stock": { "type": "string" },
            "title": { "type": "string" },
            "url": { "type": "string" },
            "sku": { "type": "string" }
          },
          "required": ["size_raw", "price", "in_stock"]
        }
      },
      "required": ["source", "field_map"],
      "allOf": [
        {
          "if": {
            "properties": { "source": { "const": "attribute" } },
            "required": ["source"]
          },
          "then": { "required": ["selector", "attribute"] }
        }
      ]
    },
    "variant_rules": {
      "type": "object",
      "additionalProperties": false,
      "properties": {
        "size_from": { "enum": ["title", "variant_label", "field"] },
        "size_pattern": { "type": "string" },
        "exclude_keywords": {
          "type": "array",
          "items": { "type": "string" }
        },
        "max_size_ml": { "type": "number", "exclusiveMinimum": 0 }
      },
      "required": ["size_from", "size_pattern", "exclude_keywords", "max_size_ml"]
    },
    "shipping": {
      "type": "object",
      "additionalProperties": false,
      "properties": {
        "free_shipping_threshold_kurus": { "type": ["integer", "null"], "minimum": 0 },
        "shipping_cost_kurus": { "type": "integer", "minimum": 0 },
        "notes": { "type": "string" }
      },
      "required": ["free_shipping_threshold_kurus", "shipping_cost_kurus"]
    },
    "discovered_at": {
      "type": "string",
      "pattern": "^\\d{4}-\\d{2}-\\d{2}T\\d{2}:\\d{2}:\\d{2}Z$"
    },
    "needs_review": {
      "type": "array",
      "items": { "type": "string" }
    }
  },
  "required": [
    "schema_version",
    "id",
    "name",
    "base_url",
    "platform",
    "strategy",
    "extraction",
    "search",
    "variant_rules",
    "shipping",
    "discovered_at",
    "needs_review"
  ],
  "allOf": [
    {
      "if": {
        "properties": { "extraction": { "const": "css" } },
        "required": ["extraction"]
      },
      "then": { "required": ["product"] }
    },
    {
      "if": {
        "properties": { "extraction": { "const": "endpoint" } },
        "required": ["extraction"]
      },
      "then": { "required": ["endpoint"] }
    },
    {
      "if": {
        "properties": { "extraction": { "const": "embedded_json" } },
        "required": ["extraction"]
      },
      "then": { "required": ["embedded_json"] }
    }
  ]
}
